tag,country,description,source,start_date,end_date,quantity
university closure,Austria,On 10 March 2020 government announced that all universities will close their classes at the latest by 16 March.,https://en.wikipedia.org/wiki/2020_coronavirus_pandemic_in_Austria,2020-03-16,,2.0
university closure,Austria,On 10 March 2020 government announced that all universities will close their classes at the latest by 16 March.,,2020-03-10,<notion.collection.NotionDate object at 0x113d5e2b0>,2.0
university closure,United Kingdom,"All schools, nurseries and colleges closed.",https://www.theguardian.com/world/2020/mar/18/coronavirus-school-colleges-nurseries-england-close-uk-friday,2020-03-20,,2.0
university closure,South Korea,Both ministry of education in Korea and China agreed to discourage both Korean and China international students to enter into both countries for upcoming semester until COVID19 resolved.  (if they enter in either nations- special entry procedure will be implemented) ,https://www.moe.go.kr/boardCnts/view.do?boardID=294&boardSeq=79905&lev=0&searchType=null&statusYN=W&page=4&s=moe&m=020402&opType=N,2020-03-01,,2.0
university closure,Singapore,Universities cancel classes and events with >50 people or move them online,,2020-02-09,,2.0
university closure,Sweden,High schools and universities told to  stop in-person classes ,https://www.theguardian.com/world/2020/mar/12/how-do-coronavirus-containment-measures-vary-across-europe,2020-03-18,,2.0
university closure,Slovenia,all educational institutions are closed,https://en.wikipedia.org/wiki/2020_coronavirus_pandemic_in_Slovenia,2020-03-16,,2.0
university closure,Mexico,Several universities suspended classes ,https://en.wikipedia.org/wiki/2020_coronavirus_pandemic_in_Mexico,2020-03-17,,2.0
university closure,Malaysia,Closure of all public and private schools from kindergartens to higher education facilities,https://en.wikipedia.org/wiki/2020_Malaysia_movement_control_order,2020-03-18,,2.0
university closure,Spain,Nationwide closure of schools after all Autonomous Communities order it. More than 10 million students (1 million from university and 9 million from schools) ordered to stay at home for a period of two weeks,https://elfarodemelilla.es/suspenden-clases-melilla-14-dias/,2020-03-12,,2.0
university closure,Spain,The regional government of La Rioja announced the suspension of classes for a period of two weeks,https://twitter.com/lariojaorg/status/1237331569938964480?s=21,2020-03-11,<notion.collection.NotionDate object at 0x114288c18>,2.0
university closure,Spain,the Basque Government announced the same measure would be enforced in the municipality of Vitoria-Gasteiz,https://en.wikipedia.org/wiki/2020_coronavirus_pandemic_in_Spain#cite_note-267,2020-03-10,,2.0
university closure,Spain,the Government of the Community of Madrid cancelled all in-person classes in the Autonomous community of Madrid at all educational levels for an initial period of 15 days,https://www.comunidad.madrid/noticias/2020/03/09/comunidad-madrid-aprueba-medidas-extraordinarias-coronavirus,2020-03-11,<notion.collection.NotionDate object at 0x113fa06a0>,2.0
university closure,Spain,temporarily closing all educational institutions in Madrid and other hard-hit regions.,https://www.ft.com/content/b91c1de6-6246-11ea-a6cd-df28cc3c6a68,2020-03-09,,2.0
university closure,China,"The start of the new semester is postponed to at least the end of February in Zhejiang,[543] Jiangsu,[543] Chongqing,[544] and Shanghai.[",http://app.cctv.com/special/cportal/detail/arti/index.html?id=Arti0Rd54yRt0cEq03jI3VsT200206&fromapp=cctvnews&version=803&version=803&allow_comment=1,2020-02-06,,2.0
university closure,China,"The start of the new semester is postponed to at least the end of February in Zhejiang,[543] Jiangsu,[543] Chongqing,[544] and Shanghai.[",http://app.cctv.com/special/cportal/detail/arti/index.html?id=Arti0Rd54yRt0cEq03jI3VsT200206&fromapp=cctvnews&version=803&version=803&allow_comment=1,2020-02-06,,2.0
university closure,China,"The start of the new semester is postponed to at least the end of February in Zhejiang,[543] Jiangsu,[543] Chongqing,[544] and Shanghai.[",http://app.cctv.com/special/cportal/detail/arti/index.html?id=Arti0Rd54yRt0cEq03jI3VsT200206&fromapp=cctvnews&version=803&version=803&allow_comment=1,2020-02-06,,2.0
university closure,China,"The start of the new semester is postponed to at least the end of February in Zhejiang,[543] Jiangsu,[543] Chongqing,[544] and Shanghai.[",http://app.cctv.com/special/cportal/detail/arti/index.html?id=Arti0Rd54yRt0cEq03jI3VsT200206&fromapp=cctvnews&version=803&version=803&allow_comment=1,2020-02-06,,2.0
university closure,China,Tianjin government issued a notice to postpone business resumption and the start of the new semester,https://web.archive.org/web/20200202141545/http://www.chinanews.com/gn/2020/02-01/9074793.shtml,2020-02-01,,2.0
university closure,China,"Hunan government required companies in the province not to resume business before 24:00 on 9 February; the new semester is not to start earlier than 17 February for primary and secondary schools and kindergartens, and 24 February for post-secondary institutions",https://web.archive.org/web/20200202065356/https://www.jiemian.com/article/3931335.html,2020-02-01,,2.0
university closure,Italy,"On 4 March, the Italian government imposed the shutdown of all schools and universities nationwide for two weeks as the country reached 100 deaths from the outbreak.",https://en.wikipedia.org/wiki/2020_coronavirus_pandemic_in_Italy,2020-03-04,,2.0
university closure,Italy,Universities in Lombardy extended their closure until 7 March.,https://en.wikipedia.org/wiki/2020_coronavirus_pandemic_in_Italy,2020-02-22,<notion.collection.NotionDate object at 0x10f09cda0>,2.0
university closure,Italy,"Multiple regions in Italy such as Liguria, Trentino Alto Adige, Friuli Venezia Giulia, Abruzzo and Marche decided to close all schools and universities for two days to a week.",https://en.wikipedia.org/wiki/2020_coronavirus_pandemic_in_Italy,2020-02-24,<notion.collection.NotionDate object at 0x113f319b0>,2.0
university closure,Italy,"Educational trips to destinations in Italy and abroad were suspended. Universities in Lombardy, Veneto, Trentino Alto-Adige, Piedmont and Emilia-Romagna suspended all activities from 23 February until 1 March.",https://en.wikipedia.org/wiki/2020_coronavirus_pandemic_in_Italy,2020-02-23,<notion.collection.NotionDate object at 0x113ee7cc0>,2.0
university closure,Italy,school facilities of all levels are closed.,https://www.mzv.cz/rome/cz/viza_a_konzularni_informace/dalsi_zesilena_opatreni_proti_sireni.html,2020-03-08,<notion.collection.NotionDate object at 0x1147e0f98>,2.0
university closure,Czechia,"personal participation in teaching at primary, secondary, tertiary and tertiary professional schools was also prohibited",https://koronavirus.mzcr.cz/vyvoj-udalosti-v-case/,2020-03-10,,2.0
university closure,Iceland,universities and secondaries schools closed for four weeks. it was announced on 13 March that all schools in the Reykjavík area would be closed on 16 March in order to prepare,https://en.wikipedia.org/wiki/2020_coronavirus_pandemic_in_Iceland,2020-03-16,<notion.collection.NotionDate object at 0x114576c50>,2.0
university closure,Iceland,"At 11:00 on 13 March, it was announced at a press conference that universities and secondary schools would be closing as of Monday 16 March, on which day a ban on public gatherings of over 100 would be put in place",https://en.wikipedia.org/wiki/2020_coronavirus_pandemic_in_Iceland,2020-03-16,,2.0
university closure,Estonia,"schools and universities were closed,",https://en.wikipedia.org/wiki/2020_coronavirus_pandemic_in_Estonia,2020-03-13,,2.0
university closure,Finland,"All schools will be closed, not including early education.",https://en.wikipedia.org/wiki/2020_coronavirus_pandemic_in_Finland,2020-03-16,<notion.collection.NotionDate object at 0x1146cecc0>,2.0
university closure,Ireland,"On 12 March Taoiseach Leo Varadkar announced the closure of all schools, colleges and childcare facilities until at least 29 March",https://en.wikipedia.org/wiki/2020_coronavirus_pandemic_in_the_Republic_of_Ireland#cite_note-:3-2,2020-03-12,<notion.collection.NotionDate object at 0x1140aa550>,2.0
university closure,Slovakia,"All nurseries, schools and universities closed",https://www.vlada.gov.sk//27391/upozornenie/,2020-03-16,,2.0
university closure,Bosnia and Herzegovina,Serb region shut all schools and universities and banned public events from March 11 to March 30 to help stem the spread of the infection.,https://www.reuters.com/article/us-health-coronavirus-bosnia/bosnias-serb-region-shuts-schools-bans-public-gatherings-over-coronavirus-idUSKBN20X2CA,2020-03-11,<notion.collection.NotionDate object at 0x1140c36a0>,2.0
university closure,Uganda,closure of all schools for 30 days,https://www.theeastafrican.co.ke/news/ea/Museveni-orders-closure-of-schools/4552908-5495920-g6x714/index.html,2020-03-20,<notion.collection.NotionDate object at 0x1140d9e48>,2.0
university closure,Morocco,All schools shut down until further notice,https://en.wikipedia.org/wiki/2020_coronavirus_pandemic_in_Morocco,2020-03-16,,2.0
university closure,Switzerland,the Federal Council decided to cancel classes in all educational establishments ,https://en.wikipedia.org/wiki/2020_coronavirus_pandemic_in_Switzerland,2020-03-13,<notion.collection.NotionDate object at 0x1149412e8>,2.0
university closure,Serbia,"All nurseries, schools and universities closed",https://exit.al/en/2020/03/16/serbia-declares-state-of-emergency-closes-borders/,2020-03-16,,2.0
university closure,Lithuania,"All educational institutions closed, including kindergardens",http://lrv.lt/en/news/education-institutions-are-closing-for-two-weeks-across-lithuania-due-to-coronavirus,2020-03-12,,2.0
university closure,Iran,School and university closures,https://en.radiofarda.com/a/iran-announces-closure-of-universities-schools-to-fight-coronavirus/30449711.html,2020-02-23,<notion.collection.NotionDate object at 0x113f204e0>,2.0
university closure,Iran,Extension of school and universities closures,https://en.wikipedia.org/wiki/2020_coronavirus_pandemic_in_Iran,2020-03-06,<notion.collection.NotionDate object at 0x113dcb160>,2.0
university closure,France,"French schools, universities and crèches will be shut from Monday due to the coronavirus outbreak",https://www.politico.eu/article/macron-orders-closure-of-french-schools-universities-due-to-coronavirus/,2020-03-16,,2.0
university closure,Poland,"All schools are closed (kindergardens, primary schools, secondary schools, universities).",https://en.wikipedia.org/wiki/2020_coronavirus_pandemic_in_Poland,2020-03-12,<notion.collection.NotionDate object at 0x113f8b438>,2.0
university closure,Denmark,"Starting 13 March, all secondary education (like gymnasiums), universities, libraries, indoor cultural institutions and similar places will be closed for two weeks.",https://en.wikipedia.org/wiki/2020_coronavirus_pandemic_in_Denmark,2020-03-13,<notion.collection.NotionDate object at 0x11456cda0>,2.0
university closure,Norway,"All the country's kindergartens, schools, secondary schools, secondary schools, colleges and universities are closed,",https://en.wikipedia.org/wiki/2020_coronavirus_pandemic_in_Norway,2020-03-12,<notion.collection.NotionDate object at 0x114873ac8>,2.0
university closure,Ukraine,"All nurseries, schools and universities closed.",https://www.kyivpost.com/ukraine-politics/breaking-ukraine-shuts-schools-mass-events-to-prevent-coronavirus-spread.html,2020-03-12,<notion.collection.NotionDate object at 0x113dbb208>,2.0
university closure,Latvia,"All [on](http://on.site)-site learning terminated, replaced with remote education  pre-schools remain open ",https://eng.lsm.lv/article/society/health/latvia-to-close-borders-to-passenger-traffic-on-tuesday-17-march.a351774/?rt=articles&ac=downloadatt&id=983,2020-03-13,<notion.collection.NotionDate object at 0x11404f898>,2.0
university closure,Malta,"All educational institutions closed, including pre- schools",https://www.maltatoday.com.mt/news/national/100955/live_prime_minister_to_announce_new_measures_related_to_coronavirus?fbclid=IwAR2-fStyF7-5t3jh-SISkoVAJOWxG6YzQdZkhlEXcPBIIr5e1j79mw7mtwU#.XnEPm0HPw2w,2020-03-13,<notion.collection.NotionDate object at 0x113d61198>,2.0
university closure,Netherlands,All universities cancel on-site teaching till 1. April,https://en.wikipedia.org/wiki/2020_coronavirus_pandemic_in_the_Netherlands#cite_note-rivm:1-6,2020-03-12,<notion.collection.NotionDate object at 0x11457fe80>,2.0
university closure,Hungary,Universities will be temporarily closed. Education may be continued via e-learning.,http://abouthungary.hu/news-in-brief/coronavirus-heres-the-latest/,2020-03-11,,2.0
university closure,Turkey,Universities closed.,https://en.wikipedia.org/wiki/2020_coronavirus_pandemic_in_Turkey,2020-03-16,<notion.collection.NotionDate object at 0x1142d95c0>,2.0
university closure,Portugal,Portugal’s Prime Minister Antonio Costa said in a press conference that all schools and universities will be closed until April 9.,https://www.aa.com.tr/en/europe/belgium-portugal-to-shut-schools-over-coronavirus/1764338,2020-03-13,<notion.collection.NotionDate object at 0x114073ba8>,2.0
university closure,Luxembourg,"All schools closed, including pre-schools",https://today.rtl.lu/news/luxembourg/a/1482367.html,2020-03-16,<notion.collection.NotionDate object at 0x1143024a8>,2.0
university closure,Greece,"Starting on March 10, the educational institutions of all levels were closed for 14 days",https://en.wikipedia.org/wiki/2020_coronavirus_pandemic_in_Greece,2020-03-10,<notion.collection.NotionDate object at 0x1143c7940>,2.0
university closure,Monaco,"All educational institutions are closed, including pre-chools",https://en.gouv.mc/Policy-Practice/Social-Affairs-and-Health/News/CORONAVIRUS-The-Prince-s-Government-has-Decided-to-Close-Creches-and-Educational-Establishments-from-Monday,2020-03-16,,2.0
university closure,Moldova,"All schools closed, including pre-schools",https://www.reuters.com/article/us-health-coronavirus-moldova/moldova-closes-schools-universities-to-prevent-virus-spread-idUSKBN20Y0VP,2020-03-11,,2.0
university closure,Macedonia,temporary 2 week closure of all education institutes (from elementary schools to universities) that might be further extended,https://en.wikipedia.org/wiki/2020_coronavirus_pandemic_in_North_Macedonia#cite_note-13,2020-03-10,<notion.collection.NotionDate object at 0x1142f3940>,2.0
outdoor gatherings banned,Austria,All outdoor events with more than 500 people and all indoor events with more than 100 people are canceled.,https://en.wikipedia.org/wiki/2020_coronavirus_pandemic_in_Austria,2020-03-10,,500.0
outdoor gatherings banned,Austria,"On 15 March, a ban was also announced for public gatherings of more than five people",https://en.wikipedia.org/wiki/2020_coronavirus_pandemic_in_Austria,2020-03-15,,5.0
outdoor gatherings banned,Germany,"the government and the federal states agreed for at least two weeks to forbid gatherings of more than two people and require a minimum distance of 1.5 metres (4 ft 11 in) between people in public except for families, partners or people living in the same household. Restaurants and services like hairdressers were to be closed",https://www.welt.de/politik/deutschland/article206725829/Coronavirus-Deutschland-Kontaktverbote-zu-mehr-als-zwei-Personen-Friseure-zu.html,2020-03-22,<notion.collection.NotionDate object at 0x113d26e80>,2.0
outdoor gatherings banned,Germany,"the federal government's crisis team recommends that all major events with more than 1,000 expected participants be canceled",https://www.bundesgesundheitsministerium.de/presse/pressemitteilungen/2020/1-quartal/krisenstab-bmg-bmi-sitzung-5.html,2020-03-10,,1000.0
outdoor gatherings banned,Germany,Federal Minister of Health Jens Spahn encourages to consistently cancel large events with more than 1000 participants until further notice.,https://www.bundesregierung.de/breg-de/themen/coronavirus/coronavirus-1725960,2020-03-09,,1000.0
outdoor gatherings banned,Singapore,Advisory against holding or attending social events with >10 people,,2020-03-26,,10.0
outdoor gatherings banned,Singapore,"All ticketed cultural, sports and entertainment events, with 250 participants or more, must be deferred or cancelled.",,2020-03-13,,250.0
outdoor gatherings banned,Singapore,All social activities for seniors organised by government agencies will be suspended for 14 days,,2020-03-10,,10.0
outdoor gatherings banned,Singapore,Advisory against holding or attending social events with >10 people,,2020-03-26,,10.0
outdoor gatherings banned,Singapore,"All events and mass gatherings (e.g. conferences, exhibitions, festivals, concerts, trade fairs) cancelled",,2020-03-26,,500.0
outdoor gatherings banned,Singapore,Large gatherings in schools and eldercare facilities cancelled,,2020-02-02,,200.0
outdoor gatherings banned,Singapore,Events with >250 cancelled,,2020-03-13,,250.0
outdoor gatherings banned,Sweden,"The Swedish government passed a new law, temporarily banning all gatherings larger than 500 people, with threat of fine and prison.",https://en.wikipedia.org/wiki/2020_coronavirus_pandemic_in_Sweden,2020-03-11,,500.0
outdoor gatherings banned,Slovenia,government restricted public gatherings in open spaces to events of 500 people or more,https://en.wikipedia.org/wiki/2020_coronavirus_pandemic_in_Slovenia,2020-03-09,,500.0
outdoor gatherings banned,Hong Kong,"The ban on more than four people getting together in public places will apply both indoors and outdoors for two weeks from Sunday, with offenders liable to a fine of up to HK$25,000 and six months in prison.
Restaurants are being ordered to slash the maximum number of customers they can host at any one time by 50 percent, with a cap of four people at each table, and with tables placed at least 1.5 metres apart from each other.
Cinemas, gyms, amusement game centres and other entertainment venues are being told to close from 6pm on Saturday.",https://news.rthk.hk/rthk/en/component/k2/1517200-20200327.htm,2020-03-27,<notion.collection.NotionDate object at 0x113c009b0>,
outdoor gatherings banned,Brazil,"This means that the whole of Brazil must unite against the virus. In practical terms, the declaration is a command from the Ministry of Health for all national managers to adopt measures to promote social distance and avoid agglomerations, known as non-pharmacological measures, that is, that do not involve the use of medicines or vaccines.",https://www.saude.gov.br/noticias/agencia-saude/46568-ministerio-da-saude-declara-transmissao-comunitaria-nacional,2020-03-20,,100.0
outdoor gatherings banned,Mexico,suspension of all meetings and events that seek to gather more than 50 people,https://www.eluniversal.com.mx/nacion/sociedad/coronavirus-30-de-marzo-mexico-supera-los-mil-contagios-de-coronavirus-suman-mil-94,2020-03-30,,50.0
outdoor gatherings banned,Mexico,Gatherings of more than 100 people are prohibited,https://en.wikipedia.org/wiki/2020_coronavirus_pandemic_in_Mexico,2020-03-24,,100.0
outdoor gatherings banned,Mexico,"Public events over 1,000 people suspended in Mexico City",https://mexiconewsdaily.com/news/coronavirus/mexico-city-bans-events-with-more-than-1000-people/,2020-03-17,,1000.0
outdoor gatherings banned,Malaysia,"banning of all types of gatherings except for funerals, however the attendees must be kept to a minimum",https://en.wikipedia.org/wiki/2020_Malaysia_movement_control_order,2020-04-01,,
outdoor gatherings banned,Malaysia,"Movement Control Order - General prohibition of movement and gatherings across the country including religious, sports, social and cultural activities",https://en.wikipedia.org/wiki/2020_Malaysia_movement_control_order,2020-03-18,,
outdoor gatherings banned,Australia,"On 29 March, Morrison addressed in a press conference following a National Cabinet meeting that public gatherings will be limited to two people",https://www.theguardian.com/australia-news/2020/mar/29/coronavirus-australia-latest-at-a-glance,2020-03-29,,2.0
outdoor gatherings banned,Australia,All gatherings of more than 500 people cancelled. ,https://en.wikipedia.org/wiki/2020_coronavirus_pandemic_in_Australia,2020-03-15,,500.0
outdoor gatherings banned,China,"Hubei implements ""hard quarantine"" in units of natural villages; no outsiders are to be allowed in and each household is allowed one person every three days to go out for provisions and urgent agricultural material, on designated routes and in limited time.",,2020-02-16,,2.0
outdoor gatherings banned,China,All nonessential public spaces in Hubei are to be closed and all gatherings forbidden,https://www.thepaper.cn/newsDetail_forward_6020319,2020-02-16,,2.0
outdoor gatherings banned,Albania,"On 16 March, another wide-ranging ""emergency legislation"" was adopted, specifying various fines for violations of protocol, to be effective immediately. Social, cultural, and political gatherings, whether in enclosed or open-air spaces, were banned, and violators could be fined up to 5 million lek (or 40,000 euros).",https://en.wikipedia.org/wiki/2020_coronavirus_pandemic_in_Albania,2020-03-16,,2.0
outdoor gatherings banned,Albania,"ordered cancellation of all large public gatherings, and asked sports federations to cancel scheduled matches",https://en.wikipedia.org/wiki/2020_coronavirus_pandemic_in_Albania,2020-03-08,,500.0
outdoor gatherings banned,Georgia,The Coordination Council recommended all elderly citizens of Georgia to avoid mass gatherings and isolate themselves.,https://en.wikipedia.org/wiki/2020_coronavirus_pandemic_in_Georgia_(country),2020-03-16,,500.0
outdoor gatherings banned,Nepal,ban gathering of more than 25 people in any public spaces including at places of worship.,https://en.wikipedia.org/wiki/2020_coronavirus_pandemic_in_Nepal,2020-03-18,,25.0
outdoor gatherings banned,Italy,"On 20 March, the Ministry of Health ordered tighter regulations on free movement. The new measures banned open-air sports and running, except individually and in close proximity of one's residence. Parks, playgrounds and public green were closed down. Furthermore, movement across the country was further restricted, by banning ""any movement towards a residence different from the main one"", including holiday homes, during weekends and holidays",https://en.wikipedia.org/wiki/2020_coronavirus_pandemic_in_Italy,2020-03-20,,2.0
outdoor gatherings banned,Italy,All public events were cancelled and some commercial activities[which?] were halted or were allowed to resume only until 6 p.m.,https://en.wikipedia.org/wiki/2020_coronavirus_pandemic_in_Italy,2020-02-22,,100.0
outdoor gatherings banned,Czechia,"From 24 March 2020 at 06.00, it is possible to stay in publicly accessible places for a maximum of two persons, with the exception of household members, occupation, business or other similar activity or participation in a funeral. ",https://koronavirus.mzcr.cz/vyvoj-udalosti-v-case/,2020-03-24,,2.0
outdoor gatherings banned,Czechia,All mass events with more than 100 people were banned at the same time,,2020-03-10,,100.0
outdoor gatherings banned,Belgium,"gatherings banned,",https://en.wikipedia.org/wiki/2020_coronavirus_pandemic_in_Belgium,2020-03-17,,1.0
outdoor gatherings banned,Iceland,"From 00:00 on 24 March, a nation-wide ban on public assemblies over 20 took effect.",https://en.wikipedia.org/wiki/2020_coronavirus_pandemic_in_Iceland,2020-03-24,,20.0
outdoor gatherings banned,Iceland,"On 21 March, a stricter ban on public assemblies was put in place in Vestmannaeyjar. Assemblies there with more than 10 persons would now be prohibited.",https://en.wikipedia.org/wiki/2020_coronavirus_pandemic_in_Iceland,2020-03-21,,10.0
outdoor gatherings banned,Iceland,"At 11:00 on 13 March, it was announced at a press conference that universities and secondary schools would be closing as of Monday 16 March, on which day a ban on public gatherings of over 100 would be put in place",,2020-03-16,,100.0
outdoor gatherings banned,Iceland,"At a press conference at 11 a.m. on 13 March, it was announced that public gatherings of more than 100 would be banned",https://en.wikipedia.org/wiki/2020_coronavirus_pandemic_in_Iceland,2020-03-13,,100.0
outdoor gatherings banned,Estonia,up to two people are allowed to gather in public space,https://en.wikipedia.org/wiki/2020_coronavirus_pandemic_in_Estonia,2020-03-24,,2.0
outdoor gatherings banned,Estonia,"All public gatherings were banned, including sports and culture events;",https://en.wikipedia.org/wiki/2020_coronavirus_pandemic_in_Estonia,2020-03-13,,10.0
outdoor gatherings banned,Finland,"At most 10 people can participate in a public meeting, and people over the age of 70 should avoid human contact if possible",https://en.wikipedia.org/wiki/2020_coronavirus_pandemic_in_Finland,2020-03-16,<notion.collection.NotionDate object at 0x10da8bbe0>,10.0
outdoor gatherings banned,Ireland,All public or private gatherings of any number of people outside a residence are prohibited.,https://en.wikipedia.org/wiki/2020_coronavirus_pandemic_in_the_Republic_of_Ireland,2020-03-27,<notion.collection.NotionDate object at 0x113fda898>,1.0
outdoor gatherings banned,Ireland,has recommended indoor gatherings of more than 100 people and outdoor gatherings of more than 500 people to be cancelled.,https://en.wikipedia.org/wiki/2020_coronavirus_pandemic_in_the_Republic_of_Ireland#cite_note-:3-2,2020-03-12,,500.0
outdoor gatherings banned,Bosnia and Herzegovina,"Since 22 March 2020, it is prohibited in Brčko District to gather and move in public places and open or closed public areas in a group of three or more persons throughout the day,",https://en.wikipedia.org/wiki/2020_coronavirus_pandemic_in_Bosnia_and_Herzegovina,2020-03-22,,3.0
