tag,country,description,source,start_date,end_date,quantity
international traveller screening - risk countries,Estonia,"border control was restored with health checks at every crossing and entry point, and the sale of passenger tickets for the Tallinn-Stockholm cruise ferries was halted.[5]",https://en.wikipedia.org/wiki/2020_coronavirus_pandemic_in_Estonia,2020-03-13,,1.0
international traveller screening - risk countries,Uganda,Screening measures have started at Entebbe International Airport in Uganda. (unclear whether risk or all countries),https://www.airport-technology.com/news/coronavirus-airports-screening-passengers/,2020-01-27,,1.0
international traveller screening - risk countries,Egypt,"Temperature sceening of travellers at airports. Reportedly, Asian tourists were screened",https://www.egypttoday.com/Article/1/82419/Health-tourism-aviation-ministers-follow-up-anti-COVID-19-measures https://www.middleeastmonitor.com/20200308-in-egypt-only-asian-tourists-get-tested-for-coronavirus/,2020-03-08,,1.0
international traveller screening - risk countries,Romania,"Romanian government announced several preventive measures including designation of five hospitals as isolation centres for new cases, purchase and placement of thermal scanners in international airports and special designated lines for passengers coming from areas affected by COVID-19 outbreak.",,2020-01-22,,1.0
international traveller screening - risk countries,France,France has announced it will also be tightening controls on its border with Germany as of Monday.,https://www.theguardian.com/world/2020/mar/15/coronavirus-causes-french-voters-to-stay-away-from-municipal-elections,2020-03-16,,1.0
international traveller screening - risk countries,Latvia,The state of health shall be observed for 14 days after leaving that country or territory by measuring the body temperature twice a day (in the morning and in the evening).,,2020-03-14,,1.0
nursery school closure,Germany,14 of the 16 German federal states decided to close their schools and nurseries for the next few weeks,https://www.zeit.de/news/2020-03/13/bayern-schliesst-alle-schulen-wegen-coronavirus-krise,2020-03-13,<notion.collection.NotionDate object at 0x113f819b0>,2.0
nursery school closure,United Kingdom,"All schools, nurseries and colleges closed.",https://www.theguardian.com/world/2020/mar/18/coronavirus-school-colleges-nurseries-england-close-uk-friday,2020-03-20,,2.0
nursery school closure,Slovenia,all educational institutions are closed,https://en.wikipedia.org/wiki/2020_coronavirus_pandemic_in_Slovenia,2020-03-16,,2.0
nursery school closure,Spain,Nationwide closure of schools after all Autonomous Communities order it. More than 10 million students (1 million from university and 9 million from schools) ordered to stay at home for a period of two weeks,https://elfarodemelilla.es/suspenden-clases-melilla-14-dias/,2020-03-12,,2.0
nursery school closure,Ireland,"On 12 March Taoiseach Leo Varadkar announced the closure of all schools, colleges and childcare facilities until at least 29 March",https://en.wikipedia.org/wiki/2020_coronavirus_pandemic_in_the_Republic_of_Ireland#cite_note-:3-2,2020-03-12,<notion.collection.NotionDate object at 0x1140aa550>,2.0
nursery school closure,Slovakia,"All nurseries, schools and universities closed",https://www.vlada.gov.sk//27391/upozornenie/,2020-03-16,,2.0
nursery school closure,Switzerland,the Federal Council decided to cancel classes in all educational establishments ,https://en.wikipedia.org/wiki/2020_coronavirus_pandemic_in_Switzerland,2020-03-13,<notion.collection.NotionDate object at 0x1149412e8>,2.0
nursery school closure,Serbia,"All nurseries, schools and universities closed",https://exit.al/en/2020/03/16/serbia-declares-state-of-emergency-closes-borders/,2020-03-16,,2.0
nursery school closure,Lithuania,"All educational institutions closed, including kindergardens",http://lrv.lt/en/news/education-institutions-are-closing-for-two-weeks-across-lithuania-due-to-coronavirus,2020-03-12,,2.0
nursery school closure,Poland,"All schools are closed (kindergardens, primary schools, secondary schools, universities).",https://en.wikipedia.org/wiki/2020_coronavirus_pandemic_in_Poland,2020-03-12,<notion.collection.NotionDate object at 0x113f8b438>,2.0
nursery school closure,Norway,"All the country's kindergartens, schools, secondary schools, secondary schools, colleges and universities are closed,",https://en.wikipedia.org/wiki/2020_coronavirus_pandemic_in_Norway,2020-03-12,<notion.collection.NotionDate object at 0x114873ac8>,2.0
nursery school closure,Ukraine,"All nurseries, schools and universities closed.",https://www.kyivpost.com/ukraine-politics/breaking-ukraine-shuts-schools-mass-events-to-prevent-coronavirus-spread.html,2020-03-12,<notion.collection.NotionDate object at 0x113dbb208>,2.0
nursery school closure,Malta,"All educational institutions closed, including pre- schools",https://www.maltatoday.com.mt/news/national/100955/live_prime_minister_to_announce_new_measures_related_to_coronavirus?fbclid=IwAR2-fStyF7-5t3jh-SISkoVAJOWxG6YzQdZkhlEXcPBIIr5e1j79mw7mtwU#.XnEPm0HPw2w,2020-03-13,<notion.collection.NotionDate object at 0x113d61198>,2.0
nursery school closure,Netherlands,"All schools are closed, including pre-schools",https://en.wikipedia.org/wiki/2020_coronavirus_pandemic_in_the_Netherlands#cite_note-rivm:1-6,2020-03-15,<notion.collection.NotionDate object at 0x11457cda0>,2.0
nursery school closure,Hungary,Municipalities can decide whether to close or keep open kindergartens within their own local power structure.,http://abouthungary.hu/news-in-brief/coronavirus-heres-the-latest/,2020-03-16,,2.0
nursery school closure,Hungary,all of kindergartens and crécches will be closed from 16th March,https://index.hu/belfold/2020/03/14/hetfotol_fokozatosan_bezarnak_a_fovarosi_ovodak/,2020-03-16,,2.0
nursery school closure,Turkey,"Primary schools, middle schools, and high schools closed.",https://en.wikipedia.org/wiki/2020_coronavirus_pandemic_in_Turkey,2020-03-16,<notion.collection.NotionDate object at 0x10daa68d0>,2.0
nursery school closure,Luxembourg,"All schools closed, including pre-schools",https://today.rtl.lu/news/luxembourg/a/1482367.html,2020-03-16,<notion.collection.NotionDate object at 0x1143024a8>,2.0
nursery school closure,Monaco,"All educational institutions are closed, including pre-chools",https://en.gouv.mc/Policy-Practice/Social-Affairs-and-Health/News/CORONAVIRUS-The-Prince-s-Government-has-Decided-to-Close-Creches-and-Educational-Establishments-from-Monday,2020-03-16,,2.0
nursery school closure,Moldova,"All schools closed, including pre-schools",https://www.reuters.com/article/us-health-coronavirus-moldova/moldova-closes-schools-universities-to-prevent-virus-spread-idUSKBN20Y0VP,2020-03-11,,2.0
domestic travel limitation,Germany,Deutsche Bahn decided to reduce its regional traffic,https://www.welt.de/wirtschaft/article206565929/Coronavirus-Deutsche-Bahn-schraenkt-Regionalverkehr-ein.html,2020-03-17,,1.0
domestic travel limitation,Sweden,the Public Health Agency of Sweden recommended that people avoid unnecessary weekend trips within Sweden,https://www.folkhalsomyndigheten.se/nyheter-och-press/nyhetsarkiv/2020/mars/tank-over-om-resan-verkligen-ar-nodvandig,2020-03-19,,1.0
domestic travel limitation,Brazil,"The following day, the government of Rio Grande do Sul declared a public calamity situation. Among the measures adopted are the prohibition of interstate travel and the restriction of items purchased in the markets.",https://g1.globo.com/rs/rio-grande-do-sul/noticia/2020/03/19/governo-decreta-situacao-de-calamidade-publica-no-rs-devido-ao-coronavirus.ghtml,2020-03-19,,1.0
domestic travel limitation,Brazil,"On 18 March, the National Indian Foundation (Funai) suspended, for the next thirty days, authorizations to enter indigenous lands due to the pandemic of the new coronavirus (COVID-19)",https://en.wikipedia.org/wiki/2020_coronavirus_pandemic_in_Brazil,2020-03-18,,1.0
domestic travel limitation,Malaysia,person must not be accompanied with other people during travel and a 10 km travel radius for all travellers except for travelling for medical reasons,https://en.wikipedia.org/wiki/2020_Malaysia_movement_control_order,2020-04-01,,1.0
domestic travel limitation,Malaysia,"PDRM conducted road blocks operations along key points accross the country, to monitor travellers and warn them to stay home and abide by the order",https://en.wikipedia.org/wiki/2020_Malaysia_movement_control_order,2020-03-18,,1.0
domestic travel limitation,China,"At 2 am on 23 January 2020, authorities issued a notice informing residents of Wuhan that from 10 am, all public transport, including buses, railways, flights, and ferry services would be suspended. The Wuhan Airport, the Wuhan railway station, and the Wuhan Metro were all closed. The residents of Wuhan were also not allowed to leave the city without permission from the authorities.",,2020-01-23,,1.0
domestic travel limitation,Albania,"As of the 15th, in addition to the private vehicle ban, the public transportation ban was extended to the Shkodra-Lezha, Elbasani-Korça, Lushnja-Fieri, and Fieri-Vlora roads.",https://en.wikipedia.org/wiki/2020_coronavirus_pandemic_in_Albania,2020-03-15,,1.0
domestic travel limitation,Nepal,vehicular movement on long routes would be closed from 23 March.,https://en.wikipedia.org/wiki/2020_coronavirus_pandemic_in_Nepal,2020-03-23,,1.0
domestic travel limitation,Nepal,"The same day, Bihar transport department suspended Patna-Nepal bus services with immediate effect, to be enforced until 31 March, in an effort to contain the virus, after many cases emerged throughout India.",https://en.wikipedia.org/wiki/2020_coronavirus_pandemic_in_Nepal,2020-03-15,<notion.collection.NotionDate object at 0x114852e48>,1.0
domestic travel limitation,Italy,"The number of checkpoints in the Red Zones was increased from 15 to 35, and army personnel were sent to help staff the checkpoints.",https://en.wikipedia.org/wiki/2020_coronavirus_pandemic_in_Italy,2020-02-25,,1.0
domestic travel limitation,Italy,"Regional train services to the most affected areas were suspended, with trains skipping stops at Codogno, Maleo and Casalpusterlengo stations.",https://en.wikipedia.org/wiki/2020_coronavirus_pandemic_in_Italy,2020-02-22,,1.0
domestic travel limitation,Czechia,"Since 19 March 2020, from 00.00 hours, the so-called ""pendlers"" have been restricted in the territory of the Czech Republic, only to the strictly necessary needs with the exception of:
necessary trips to family or loved ones
trips necessary to meet the needs of another person (eg volunteering, neighborhood assistance)
movement in nature
travel to deal with urgent official matters",https://koronavirus.mzcr.cz/vyvoj-udalosti-v-case/,2020-03-19,,1.0
domestic travel limitation,Estonia,The Estonian shipping company Tallink decided to suspend their ferry service on the Tallinn-Stockholm route from 15 March,https://en.wikipedia.org/wiki/2020_coronavirus_pandemic_in_Estonia,2020-03-15,,1.0
domestic travel limitation,Cyprus,"As regards the crossing points between the free and the occupied areas, entry will be permitted only to persons falling into the following categories:
Cypriot citizens, Greek Cypriots and Turkish Cypriots.
Legal residents in the free areas.
Nationals of countries who are in a designated diplomatic service or mission under bilateral or international conventions.
I appeal to all Cypriots to use the crossing points when absolutely necessary.",https://in-cyprus.philenews.com/coronavirus-president-announces-new-measures-full-text-of-tv-address/,2020-03-15,<notion.collection.NotionDate object at 0x1140d5c50>,1.0
domestic travel limitation,Croatia,"On 11 March, after a ferry from Ancona sailed into the Port of Split, the Ancona-Split ferry line was cancelled.",https://en.wikipedia.org/wiki/2020_coronavirus_pandemic_in_Croatia,2020-03-11,,1.0
domestic travel limitation,Greece,"On the same day, it was also announced that daytime public transport services will be limited, although ensuring sufficient service during business hours. Journeys by car are only permitted for the specific exemptions, and the driver may only have one passenger in the vehicle. In addition, all parks, recreation areas and marinas were closed.",https://en.wikipedia.org/wiki/2020_coronavirus_pandemic_in_Greece,2020-03-22,,1.0
general nonessential business suspension,Germany,"Supermarkets, chemist's shops, banks, pet shops, and all business that sell essential basic needs are allowed extended opening times including Sundays, while non-essential stores are to be closed at all times",https://www.bundesregierung.de/breg-de/themen/coronavirus/leitlinien-bund-laender-1731000,2020-03-16,,2.0
general nonessential business suspension,Israel,"Venues required to close: malls, restaurants, hotel dining rooms, pubs, dance clubs, gyms, pools, beaches, water and amusement parks, zoos and petting zoos, bathhouses and ritual baths for men, beauty and massage salons, event and conference venues, public boats and cable cars, and heritage sites. Take-away restaurants, supermarkets and pharmacies were to remain open",https://en.wikipedia.org/wiki/2020_coronavirus_pandemic_in_Israel,2020-03-15,,2.0
general nonessential business suspension,Slovenia,"The provision and sale of goods and services directly to consumers in the territory of the Republic of Slovenia was temporarily banned on 16 March. These include accommodation, catering, wellness, sports and recreational, cinematographic, cultural, hairdressing, cosmetics and pedicure services, including gaming and other similar activities.",https://www.gov.si/en/topics/coronavirus-disease-covid-19/koronavirus-preparedness-and-measures-in-slovenia/,2020-03-16,,2.0
general nonessential business suspension,Hong Kong,"- The exams for the Hong Kong Diploma of Secondary Education will be postponed and oral exams cancelled. The key tests, which are a reference for university enrollment, will be pushed back to April 24 and schools will remain closed until further notice.
- Only essential government services will be in operation as of Monday. Libraries, museums and leisure facilities will close, after they reopened at the start of March, as Lam urged private sector employers to roll out work-from-home arrangements.
- The government will give two face masks per day to seniors at elderly homes",https://www.hongkongfp.com/2020/03/21/breaking-civil-servants-work-remotely-school-exams-postponed-hong-kong-sees-spike-coronavirus-cases/,2020-03-21,<notion.collection.NotionDate object at 0x113d03eb8>,2.0
general nonessential business suspension,Mexico,"all non-essential public, private and social sector activities, including the collection of data for the 2020 national census, must be suspended between March 30 and April 30",https://mexiconewsdaily.com/news/coronavirus/national-coronavirus-emergency-declared/,2020-03-30,,2.0
general nonessential business suspension,Malaysia,"all houses of worship and business premises should be closed, except for supermarkets, public markets, grocery stores and convenience stores selling everyday necessities.",https://en.wikipedia.org/wiki/2020_Malaysia_movement_control_order,2020-03-18,,2.0
general nonessential business suspension,Spain,"On 28 March, the prime minister ordered all non-essential workers to stay at home from 30 March to 9 April to bend the curve and contain the epidemic.",https://www.lavanguardia.com/politica/20200328/48136764563/gobierno-trabajadores-servicios-no-esenciales-30-de-marzo-9-de-abril-semana-santa-pedro-sanchez-coronavirus.html,2020-03-28,,2.0
general nonessential business suspension,Spain,"state of emergency on Saturday, ordering the closure of all non-essential shops as well as bars, restaurants, cafes, football grounds and cinemas.",https://www.theguardian.com/world/2020/mar/15/spain-city-streets-turn-quiet-coronavirus-lockdown-madrid-barcelona,2020-03-14,,2.0
general nonessential business suspension,Spain,"state of emergency on Saturday, ordering the closure of all non-essential shops as well as bars, restaurants, cafes, football grounds and cinemas.",https://www.theguardian.com/world/2020/mar/15/spain-city-streets-turn-quiet-coronavirus-lockdown-madrid-barcelona,2020-03-14,,2.0
general nonessential business suspension,Spain,"Spain impose nationwide lockdown (all stores except groceries and pharmacies). According to the government decree, people will only be allowed to leave their homes to buy food and medicine, commute to work, go to medical centers and banks, or take trips related to the care for the young and the elderly.",https://www.cnbc.com/2020/03/14/spain-declares-state-of-emergency-due-to-coronavirus.html,2020-03-14,,2.0
general nonessential business suspension,China,"On 26 January, the State Council extended the 2020 Spring Festival holiday to 2 February (Sunday, the ninth day of the first lunar month) with 3 February (Monday) marking the start of normal work. The educational institutions postponed the start of school.",http://www.gov.cn/zhengce/content/2020-01/27/content_5472352.htm,2020-01-26,,2.0
general nonessential business suspension,China,Apple extends the shutdown period of its stores and corporate offices in China. They will reopen at some time during the week of 10 February which is the week after the originally stated week Apple said they will reopen,https://www.cnbc.com/2020/02/07/apple-extends-its-store-closures-in-china-due-to-the-coronavirus.html,2020-02-08,<notion.collection.NotionDate object at 0x1143027f0>,2.0
general nonessential business suspension,China,"Hubei requires businesses in the province not to resume before 10 March, except for essential industries.",http://www.nbd.com.cn/articles/2020-02-20/1409863.html,2020-02-19,,2.0
general nonessential business suspension,China,"Jingmen, Hubei escalated control, prohibiting outside vehicles and persons from entering its central districts except for medical and living supplies, and shutting down all business except approved pharmacies, supermarkets, and hotels",https://en.wikipedia.org/wiki/Timeline_of_the_2019–20_coronavirus_pandemic_in_February_2020#cite_note-621,2020-02-15,,2.0
general nonessential business suspension,China,Hubei postponed business resumption and start of new semester across the province; businesses were not to resume before 24:00 on 20 Feb,https://www.jiemian.com/article/3979654.html,2020-02-13,,2.0
general nonessential business suspension,China,The Chinese New Year holiday period ended after having been extended for a week.,http://finance.chinanews.com/cj/2020/02-03/9077187.shtml,2020-02-03,,2.0
general nonessential business suspension,China,Tianjin government issued a notice to postpone business resumption and the start of the new semester,https://web.archive.org/web/20200202141545/http://www.chinanews.com/gn/2020/02-01/9074793.shtml,2020-02-01,,2.0
general nonessential business suspension,China,"Hunan government required companies in the province not to resume business before 24:00 on 9 February; the new semester is not to start earlier than 17 February for primary and secondary schools and kindergartens, and 24 February for post-secondary institutions",https://web.archive.org/web/20200202065356/https://www.jiemian.com/article/3931335.html,2020-02-01,,2.0
general nonessential business suspension,Italy,"In the evening, Conte announced a tightening of the lockdown, with all commercial and retail businesses except those providing essential services, like grocery stores and pharmacies, closed down. He also appointed Domenico Arcuri as Delegated Commissioner for the Emergency. Arcuri will cooperate with Commissioner Angelo Borrelli with the aim of strengthening the distribution of intensive care equipment.",https://en.wikipedia.org/wiki/2020_coronavirus_pandemic_in_Italy,2020-03-11,,2.0
general nonessential business suspension,Italy,closures of companies,https://www.mzv.cz/rome/cz/viza_a_konzularni_informace/dalsi_zesilena_opatreni_proti_sireni.html,2020-03-12,<notion.collection.NotionDate object at 0x1143400b8>,2.0
general nonessential business suspension,Italy,"closure of shops (supermarkets, grocery, pharmacy)",https://www.mzv.cz/rome/cz/viza_a_konzularni_informace/dalsi_zesilena_opatreni_proti_sireni.html,2020-03-12,<notion.collection.NotionDate object at 0x113f9dd30>,2.0
general nonessential business suspension,Czechia,closure of shops,https://koronavirus.mzcr.cz/vyvoj-udalosti-v-case/,2020-03-14,<notion.collection.NotionDate object at 0x11472e9b0>,2.0
general nonessential business suspension,Belgium,"non-essential shops to close,",https://en.wikipedia.org/wiki/2020_coronavirus_pandemic_in_Belgium,2020-03-17,,2.0
general nonessential business suspension,Belgium,"Beginning Saturday, only stores that provide essential services -- such as pharmacies and grocery stores-- will remain open under normal conditions. All other stores will remain open during the week, but closed at weekends.",https://www.thejakartapost.com/news/2020/03/13/belgium-closes-schools-bars-to-fight-coronavirus-outbreak.html,2020-03-14,,2.0
general nonessential business suspension,Iceland,"closed, as did any businesses requiring a proximity of less than 2 m (hairdressers, tattoo artists, etc.).",https://en.wikipedia.org/wiki/2020_coronavirus_pandemic_in_Iceland,2020-03-24,,2.0
general nonessential business suspension,Andorra,"On 13 March, the Prime Minister Xavier Espot announced in a special public appearance that ordered the closure of all public establishments except basic stores, pharmacies and gas stations during two weeks",https://en.wikipedia.org/wiki/2020_coronavirus_pandemic_in_Andorra,2020-03-13,<notion.collection.NotionDate object at 0x113e612b0>,2.0
general nonessential business suspension,Finland,"The following day, the Finnish airline Finnair announced it suspended five weekly routes to Nanjing and Beijing Daxing until the end of March.[6]",https://en.wikipedia.org/wiki/2020_coronavirus_pandemic_in_Finland,2020-01-27,<notion.collection.NotionDate object at 0x10da8b780>,2.0
general nonessential business suspension,Slovakia,"Shops and service operations are closed for 14 days. First introduced for the weekend of March 14-15, prolonged for another 14 days on March 16",https://www.rtvs.sk/televizia/clanky/219873/na-slovensku-platia-od-pondelka-16-3-nove-opatrenia,2020-03-14,<notion.collection.NotionDate object at 0x113d3aa90>,2.0
general nonessential business suspension,Bosnia and Herzegovina,"The Headquarters of Federation of B&H issued on 18 March an order that banned all public gatherings, suspending the operation of all catering facilities for the preparation and sale of food and beverages, restaurants, pizzerias, confectioneries, beauty salons, hookah bars, coffee bars, discos, tea shops, cafes, private dentists.",https://en.wikipedia.org/wiki/2020_coronavirus_pandemic_in_Bosnia_and_Herzegovina,2020-03-18,,2.0
general nonessential business suspension,Bosnia and Herzegovina,"On March 15th, Banja Luka has decided to close all restaurants and cafés in the city. Except drugstores, hotels and motels, where drugstores will be working until 22h and hotels will be working until 18h.",https://en.wikipedia.org/wiki/2020_coronavirus_pandemic_in_Bosnia_and_Herzegovina,2020-03-15,,2.0
general nonessential business suspension,Cyprus,"All retailers shall suspend their operations, except from the businesses that are included in
the Decree issued by the Minister of Health",https://www.pio.gov.cy/coronavirus/en/press/latest.pdf,2020-03-24,<notion.collection.NotionDate object at 0x114460320>,2.0
general nonessential business suspension,Kazakhstan,"Also, all stores and shopping malls in the two major cities will be closed and only grocery and drug stores will be allowed to operate during the quarantine.",https://www.rferl.org/a/armenia-puts-restrictions-on-public-and-private-events-amid-spike-in-coronavirus-cases/30492284.html,2020-03-17,,2.0
general nonessential business suspension,Switzerland,"the Federal Council has declared an ""extraordinary situation"" and introduces stringent measures such as closing all shops, restaurants, bars, entertainment and leisure facilities, or carful screening at borders with Austria, Germany and France. The Federal Council has also authorised the deployment of up to 8000 members of the armed forces to assist the cantons at hospitals and with logistics and security.",https://www.admin.ch/gov/en/start/documentation/media-releases.msg-id-78454.html,2020-03-16,<notion.collection.NotionDate object at 0x113e01860>,2.0
general nonessential business suspension,Switzerland,"the closure of bars, shops and other gathering places",https://en.wikipedia.org/wiki/2020_coronavirus_pandemic_in_Switzerland,2020-03-16,,2.0
general nonessential business suspension,Serbia,All business in shopping malls was prohibited except for grocery stores and pharmacies,https://en.wikipedia.org/wiki/2020_coronavirus_pandemic_in_Serbia,2020-03-21,,2.0
general nonessential business suspension,Serbia,All business in shopping malls was prohibited except for grocery stores and pharmacies,https://en.wikipedia.org/wiki/2020_coronavirus_pandemic_in_Serbia,2020-03-21,,2.0
general nonessential business suspension,Lithuania,"All shops and businesses excluding grocery shops, pharmacies and veterinary pharmacies were closed; all restaurants and bars were closed,",https://www.lrt.lt/en/news-in-english/19/1151798/lithuania-under-quarantine-key-instructions-and-recommendations,2020-03-16,,2.0
general nonessential business suspension,France,"the closure of all non-essential shops and businesses, including museums, restaurants and cinemas until 15 April. Bars and restaurants can continue offering a takeaway or delivery service.",https://www.theguardian.com/world/2020/mar/15/coronavirus-causes-french-voters-to-stay-away-from-municipal-elections,2020-03-15,<notion.collection.NotionDate object at 0x113e098d0>,2.0
