tag,country,description,source,start_date,end_date,quantity
school closure,Portugal,Prime Minister António Costa decreed the closure of all public and private educational establishments from 16 March until 9 April at least.,https://sicnoticias.pt/especiais/coronavirus/2020-03-12-Todas-as-escolas-fechadas-ate-12-de-abril,2020-03-16,<notion.collection.NotionDate object at 0x113e0c940>,2.0
school closure,Portugal,Portugal’s Prime Minister Antonio Costa said in a press conference that all schools and universities will be closed until April 9.,https://www.aa.com.tr/en/europe/belgium-portugal-to-shut-schools-over-coronavirus/1764338,2020-03-13,<notion.collection.NotionDate object at 0x114073ba8>,2.0
school closure,Luxembourg,"All schools closed, including pre-schools",https://today.rtl.lu/news/luxembourg/a/1482367.html,2020-03-16,<notion.collection.NotionDate object at 0x1143024a8>,2.0
school closure,Luxembourg,"Meanwhile, Luxembourg’s Health Minister Paulette Lenert announced that all schools in the country will be closed as of March 16 until March 27.",https://www.aa.com.tr/en/europe/belgium-portugal-to-shut-schools-over-coronavirus/1764338,2020-03-16,<notion.collection.NotionDate object at 0x1140a2240>,2.0
school closure,Greece,"Starting on March 10, the educational institutions of all levels were closed for 14 days",https://en.wikipedia.org/wiki/2020_coronavirus_pandemic_in_Greece,2020-03-10,<notion.collection.NotionDate object at 0x1143c7940>,2.0
school closure,Greece,"On March 9, all school trips were banned,",https://en.wikipedia.org/wiki/2020_coronavirus_pandemic_in_Greece,2020-03-09,,2.0
school closure,Bulgaria,"At the time of the announcement, schools had already been closed until March 11 due to an influenza B epidemic.[26] A massive increase in influenza B cases prompted suspensions of routine medical examinations, and a recommendation by the government for suspension of lectures at universities.[27] According to the latest Ministry of Health data, there were 2063 intensive care and 740 infectious disease hospital beds in the country, with a total of 1605 ventilators across the health system.[28] However, Chief Health Inspector Angel Kunchev stated on 5 March that there is a shortage of medical personnel. Schools, shopping centres, cinemas, restaurants, and other places of business were closed.",https://en.wikipedia.org/wiki/2020_coronavirus_pandemic_in_Bulgaria,2020-03-13,,2.0
school closure,Monaco,"All educational institutions are closed, including pre-chools",https://en.gouv.mc/Policy-Practice/Social-Affairs-and-Health/News/CORONAVIRUS-The-Prince-s-Government-has-Decided-to-Close-Creches-and-Educational-Establishments-from-Monday,2020-03-16,,2.0
school closure,Moldova,"All schools closed, including pre-schools",https://www.reuters.com/article/us-health-coronavirus-moldova/moldova-closes-schools-universities-to-prevent-virus-spread-idUSKBN20Y0VP,2020-03-11,,2.0
school closure,Macedonia,temporary 2 week closure of all education institutes (from elementary schools to universities) that might be further extended,https://en.wikipedia.org/wiki/2020_coronavirus_pandemic_in_North_Macedonia#cite_note-13,2020-03-10,<notion.collection.NotionDate object at 0x1142f3940>,2.0
indoor gatherings banned,Austria,All outdoor events with more than 500 people and all indoor events with more than 100 people are canceled.,https://en.wikipedia.org/wiki/2020_coronavirus_pandemic_in_Austria,2020-03-10,,100.0
indoor gatherings banned,Slovenia,government restricted public gatherings in closed spaces to events of 100 people or more,https://en.wikipedia.org/wiki/2020_coronavirus_pandemic_in_Slovenia,2020-03-09,,100.0
indoor gatherings banned,Mexico,suspension of all meetings and events that seek to gather more than 50 people,https://www.eluniversal.com.mx/nacion/sociedad/coronavirus-30-de-marzo-mexico-supera-los-mil-contagios-de-coronavirus-suman-mil-94,2020-03-30,,50.0
indoor gatherings banned,Mexico,Gatherings of more than 100 people are prohibited,https://en.wikipedia.org/wiki/2020_coronavirus_pandemic_in_Mexico,2020-03-24,,100.0
indoor gatherings banned,Malaysia,"banning of all types of gatherings except for funerals, however the attendees must be kept to a minimum",https://en.wikipedia.org/wiki/2020_Malaysia_movement_control_order,2020-04-01,,
indoor gatherings banned,Malaysia,"Movement Control Order - General prohibition of movement and gatherings across the country including religious, sports, social and cultural activities",https://en.wikipedia.org/wiki/2020_Malaysia_movement_control_order,2020-03-18,,
indoor gatherings banned,Ireland,has recommended indoor gatherings of more than 100 people and outdoor gatherings of more than 500 people to be cancelled.,https://en.wikipedia.org/wiki/2020_coronavirus_pandemic_in_the_Republic_of_Ireland#cite_note-:3-2,2020-03-12,,100.0
indoor gatherings banned,Uganda,"Public gatherings including worship, pubs, weddings, music shows, rallies and cultural meetings have been suspended for 32 days with immediate effect.",https://www.theeastafrican.co.ke/news/ea/Museveni-orders-closure-of-schools/4552908-5495920-g6x714/index.html',2020-03-20,<notion.collection.NotionDate object at 0x114459cc0>,
indoor gatherings banned,Romania,"The authorities have imposed a ban on sports, scientific, religious, cultural or entertainment events with over 100 participants in closed spaces until 31 March.",https://en.wikipedia.org/wiki/2020_coronavirus_pandemic_in_Romania,2020-03-11,<notion.collection.NotionDate object at 0x1143b70b8>,100.0
indoor gatherings banned,Serbia,Public gatherings in closed premises with more than 100 persons are prohibited,https://sr.wikipedia.org/wiki/Епидемија_вируса_корона_у_Србији_2020,2020-03-12,,100.0
indoor gatherings banned,Denmark,"The Folketing (Danish Parliament) cancelled some of their regular meetings and hearings, and when voting a clearing system will be used to avoid having more than 95 members in the main chamber at any one time",https://en.wikipedia.org/wiki/2020_coronavirus_pandemic_in_Denmark,2020-03-12,,100.0
indoor gatherings banned,Hungary,All indoor events larger than 100 and outdoor events above 500 will be prohibited. Gatherings of large groups will be banned to stop the spread of coronavirus.,http://abouthungary.hu/news-in-brief/coronavirus-heres-the-latest/,2020-03-11,,100.0
indoor gatherings banned,Bulgaria,The government issued a nationwide ban on closed-door public events.,https://en.wikipedia.org/wiki/2020_coronavirus_pandemic_in_Bulgaria,2020-03-08,,2.0
international travel ban - risk countries,Austria,Travel restrictions for people coming from Italy are established.,https://en.wikipedia.org/wiki/2020_coronavirus_pandemic_in_Austria,2020-03-10,,5.0
international travel ban - risk countries,Germany,"After a case was suspected in a Lufthansa plane, the company suspended all flights to China + This also applies to all flights operated by Swiss and Austrian Airlines",https://www.hna.de/politik/coronavirus-massnahmen-politik-bundesregierung-deutschland-lufthansa-ikea-fluege-jens-spahn-zr-13505568.html,2020-01-28,<notion.collection.NotionDate object at 0x114873390>,5.0
international travel ban - risk countries,Singapore,All visitors from mainland China are blocked from entering Singapore,,2020-01-31,,5.0
international travel ban - risk countries,Singapore,No cruise vessels allowed,,2020-03-13,,5.0
international travel ban - risk countries,Singapore,Visitors from Hubei are banned,,2020-01-29,,5.0
international travel ban - risk countries,Singapore,"Visitors from France, Germany, Italy, Spain banned",,2020-03-15,,5.0
international travel ban - risk countries,Singapore,"Visitors from Iran, northern Italy, South Korea banned",,2020-03-04,,5.0
international travel ban - risk countries,Singapore,Visitors from Daegu and Cheongdo (South Korea) banned,,2020-02-26,,5.0
international travel ban - risk countries,Singapore,Visitors from Mainland China banned,,2020-02-01,,5.0
international travel ban - risk countries,Israel,Israel suspended all flights from China.,https://en.wikipedia.org/wiki/2020_coronavirus_pandemic_in_Israel,2020-01-30,,5.0
international travel ban - risk countries,Israel,"Israel suspended all flights from Thailand, Hong Kong, Macau and Singapore.",https://en.wikipedia.org/wiki/2020_coronavirus_pandemic_in_Israel,2020-02-17,,5.0
international travel ban - risk countries,Japan,The Government of Japan barred: entry restrictions for anyone who had travelled to and from Zhejiang or had a Chinese passport issued from Zhejiang ,https://www.mhlw.go.jp/english/,2020-02-12,,5.0
international travel ban - risk countries,Japan,"The Government of Japan barred: entry of foreign nationals infected with the virus, and entry of Chinese citizens with passports issued in Hubei province.",https://japantoday.com/category/national/Japan-bars-entry-of-foreign-travelers-from-China's-Hubei-Province,2020-02-01,,5.0
international travel ban - risk countries,Slovenia,land border with Italy was closed for all but freight transport,https://en.wikipedia.org/wiki/2020_coronavirus_pandemic_in_Slovenia,2020-03-10,,5.0
international travel ban - risk countries,Brazil,Brazilian authorities partially closed their border with Venezuela,https://www.reuters.com/article/us-health-coronavirus-brazil-venezuela-idUSKBN2143ZS,2020-03-17,,5.0
international travel ban - risk countries,Malaysia,"full restriction on foreign nationals directly from Italy, Iran and South Korea for the whole Malaysia",https://en.wikipedia.org/wiki/2020_Malaysia_movement_control_order,2020-03-13,,5.0
international travel ban - risk countries,Malaysia,ban on travellers from  Chinese provinces of Jiangsu and Zhejiang,https://en.wikipedia.org/wiki/2020_Malaysia_movement_control_order,2020-02-09,,5.0
international travel ban - risk countries,Malaysia,ban on travellers from Hube,https://en.wikipedia.org/wiki/2020_Malaysia_movement_control_order,2020-01-27,,5.0
international travel ban - risk countries,Spain,the Government of Spain decreed the immediate cancellation of all direct flights from Italy to Spain until 25 March,https://www.elespanol.com/invertia/empresas/20200310/espana-prohibe-vuelos-directos-italia-marzo/473703280_0.html,2020-03-10,<notion.collection.NotionDate object at 0x113dcb320>,5.0
international travel ban - risk countries,Albania,The Albanian government began organizing a charter flight to extract remaining Albanian citizens in Italy; all air travel to Italy and Greece was indefinitely suspended.,https://en.wikipedia.org/wiki/2020_coronavirus_pandemic_in_Albania,2020-03-15,,5.0
international travel ban - risk countries,Albania,Sea travel from Greece and Italy was prohibited except for freight vessels.,https://en.wikipedia.org/wiki/2020_coronavirus_pandemic_in_Albania,2020-03-13,,5.0
international travel ban - risk countries,Albania,"By the 12th, 500 people had been charged for violating the travel ban.",https://en.wikipedia.org/wiki/2020_coronavirus_pandemic_in_Albania,2020-03-12,,5.0
international travel ban - risk countries,Albania,"On 8 March, the government stopped all flights and ferries with quarantined areas of northern Italy until 3rd April,",https://en.wikipedia.org/wiki/2020_coronavirus_pandemic_in_Albania,2020-03-08,<notion.collection.NotionDate object at 0x11410a630>,5.0
international travel ban - risk countries,Georgia,"Prime Minister Giorgi Gakharia sets up an Inter-Agency Council for Coordination Against the Coronavirus (IACC), made of representatives of every major government agency, to manage the situation. The IACC's first decision is to ban flights to Iran.",https://en.wikipedia.org/wiki/2020_coronavirus_pandemic_in_Georgia_(country),2020-02-26,,5.0
international travel ban - risk countries,Georgia,Turkish citizens who visited coronavirus-infected countries are banned from crossing the Georgian-Turkish border.,https://en.wikipedia.org/wiki/2020_coronavirus_pandemic_in_Georgia_(country),2020-02-27,,5.0
international travel ban - risk countries,Georgia,"Georgia calls the outbreak of the coronavirus in neighboring Iran a ""serious concern"" and suspends direct flights with the Islamic Republic.",https://en.wikipedia.org/wiki/2020_coronavirus_pandemic_in_Georgia_(country),2020-02-23,,5.0
international travel ban - risk countries,Georgia,Georgia suspends direct flights with China for two months.,https://en.wikipedia.org/wiki/2020_coronavirus_pandemic_in_Georgia_(country),2020-01-29,<notion.collection.NotionDate object at 0x1132ffb00>,5.0
international travel ban - risk countries,Georgia,Georgia also temporarily shut down all flights to Iran.[2],https://en.wikipedia.org/wiki/2020_coronavirus_pandemic_in_Georgia_(country),2020-01-27,,5.0
international travel ban - risk countries,Georgia,All flights from China and Wuhan to Tbilisi International Airport were cancelled until 27 January.,https://en.wikipedia.org/wiki/2020_coronavirus_pandemic_in_Georgia_(country),2020-01-27,,5.0
international travel ban - risk countries,Nepal,The government decided to extend the suspension of international flights to until 15 April.,https://en.wikipedia.org/wiki/2020_coronavirus_pandemic_in_Nepal,2020-04-29,<notion.collection.NotionDate object at 0x1063da908>,5.0
international travel ban - risk countries,Nepal,Nepal decided to close its land border with India and China for a week effective from 23 March.,https://en.wikipedia.org/wiki/2020_coronavirus_pandemic_in_Nepal,2020-03-23,<notion.collection.NotionDate object at 0x11464cc18>,5.0
international travel ban - risk countries,Nepal,"The government banned all passengers, including Nepalis, from EU and the UK, West Asia and the Middle East as well as Malaysia, South Korea and Japan, effective from 20 March until 15 April.",https://en.wikipedia.org/wiki/2020_coronavirus_pandemic_in_Nepal,2020-03-20,<notion.collection.NotionDate object at 0x1140f7588>,5.0
international travel ban - risk countries,Nepal,"The Supreme Court issued an interim order to suspend flights to and from countries affected by the disease, in response to a public interest litigation. The government issued a travel advisory against non-essential travel to countries hardest hit by the disease, including China, Iran, South Korea, Japan and Italy.",https://en.wikipedia.org/wiki/2020_coronavirus_pandemic_in_Nepal,2020-03-02,,5.0
international travel ban - risk countries,Nepal,"On 28 January, Nepal closed down the Rasuwagadhi border with China, bringing Nepal-China trade to a complete halt.",https://en.wikipedia.org/wiki/2020_coronavirus_pandemic_in_Nepal,2020-01-28,,5.0
international travel ban - risk countries,Italy,"On 31 January, the Italian government suspended all flights to and from China",https://en.wikipedia.org/wiki/2020_coronavirus_pandemic_in_Italy,2020-01-31,,5.0
international travel ban - risk countries,Czechia,"On Monday, February 3, 2020, Minister of Health Adam Vojtěch signed a protective measure banning all direct flights from China to all international airports in the Czech Republic from Sunday, February 9, 2020 until further notice.",https://koronavirus.mzcr.cz/vyvoj-udalosti-v-case/,2020-02-03,,5.0
international travel ban - risk countries,Czechia,"On Monday, March 2, 2020, the Security Council met. With effect from 5 March for 14 days, it suspended air connections to areas in northern Italy and South Korea. Following this decision, the Minister of Health issued appropriate safeguards: suspension of flights from northern Italy and suspension of flights from South Korea.",https://koronavirus.mzcr.cz/vyvoj-udalosti-v-case/,2020-03-05,<notion.collection.NotionDate object at 0x1142cdcc0>,5.0
international travel ban - risk countries,Ireland,Flights to and from some affected regions were suspended.[48],https://en.wikipedia.org/wiki/2020_coronavirus_pandemic_in_the_Republic_of_Ireland#cite_note-:3-2,2020-03-10,,5.0
international travel ban - risk countries,Bosnia and Herzegovina,"On 15 March 2020, Council of Ministers of Bosnia and Herzegovina issued a decision which forbids for foreign nationals entering Bosnia and Herzegovina to enter from areas with intensive transmission of virus coronas, and especially from: Provinces of the PRC (Wuhan), South Korea, Japan, Italy, Iran, France, Romania, Germany, Austria, Spain, Switzerland and Belgium.",https://en.wikipedia.org/wiki/2020_coronavirus_pandemic_in_Bosnia_and_Herzegovina,2020-03-15,,5.0
international travel ban - risk countries,Bosnia and Herzegovina,entry to travelers from countries most affected by the coronavirus outbreak,https://www.reuters.com/article/us-health-coronavirus-bosnia/bosnias-serb-region-shuts-schools-bans-public-gatherings-over-coronavirus-idUSKBN20X2CA,2020-03-10,,5.0
international travel ban - risk countries,Uganda,banned all incoming and outgoing travel to specified highly affected countries for a period of 32 days,https://en.wikipedia.org/wiki/2020_coronavirus_pandemic_in_Uganda,2020-03-18,<notion.collection.NotionDate object at 0x11400d3c8>,5.0
international travel ban - risk countries,Russia,Border with China is closed.,https://www.cnbc.com/2020/01/30/coronavirus-russia-closes-border-with-china-to-prevent-spread.html,2020-01-30,,5.0
international travel ban - risk countries,Russia,"Russia will temporarily restrict the entry of foreigners arriving from China, Deputy Prime Minister Tatiana Golikova said. She said the restrictions would not apply to Moscow's Sheremetyevo Airport, the capital's main international airport.",https://www.themoscowtimes.com/2020/03/18/coronavirus-in-russia-the-latest-news-march-18-a69117,2020-02-03,,5.0
international travel ban - risk countries,Russia,"Russian Railways announced it would stop international passenger trains from Moscow to Berlin and Paris. Earlier it was announced that train connections to and from Ukraine, Moldova and Latvia will be suspended.",https://www.themoscowtimes.com/2020/03/18/coronavirus-in-russia-the-latest-news-march-18-a69117,2020-03-15,,5.0
international travel ban - risk countries,Russia,The Russian government temporarily barred Iranian citizens from entering Russia.,https://www.themoscowtimes.com/2020/03/18/coronavirus-in-russia-the-latest-news-march-18-a69117,2020-02-28,,5.0
international travel ban - risk countries,Russia,"Russia will limit flights to the United States, Britain and the United Arab Emirates starting Friday, Prime Minister Mikhail Mishustin ordered.",https://www.themoscowtimes.com/2020/03/18/coronavirus-in-russia-the-latest-news-march-18-a69117,2020-03-20,,5.0
international travel ban - risk countries,Russia,"Russia has closed its border with neighboring Belarus as a ""proactive step"" to halt the coronavirus' spread, the state-run TASS news agency quoted Prime Minister Mikhail Mishustin as saying.",https://www.themoscowtimes.com/2020/03/18/coronavirus-in-russia-the-latest-news-march-18-a69117,2020-03-16,,5.0
international travel ban - risk countries,Russia,"The Russian government temporarily barred  entry of South Korean citizens from March 1 as a precaution against the spread of coronavirus, decrees published online showed. Moscow will suspend flights between Russia and South Korea from March 1 over coronavirus fears, except those operated by Aeroflot and Aurora, Deputy Prime Minister Tatiana Golikova said.",https://www.themoscowtimes.com/2020/03/18/coronavirus-in-russia-the-latest-news-march-18-a69117,2020-03-01,,5.0
international travel ban - risk countries,Russia,Russia's border will temporarily be closed to Italian citizens and foreigners traveling from Italy as Italy continues to grapple with the worst coronavirus outbreak in Europe.,https://www.themoscowtimes.com/2020/03/18/coronavirus-in-russia-the-latest-news-march-18-a69117,2020-03-13,,5.0
international travel ban - risk countries,Egypt,"Suspension of flights to and from Khartoum, Sudan",https://www.middleeastmonitor.com/20200314-egypt-suspends-flights-with-sudan-over-coronavirus-concerns/,2020-03-13,,5.0
international travel ban - risk countries,Egypt,Flights from China to Egypt banned,https://en.wikipedia.org/wiki/2020_coronavirus_pandemic_in_Egypt,2020-01-26,,5.0
international travel ban - risk countries,Romania,All bus rides and rail transport to and from Italy were suspended from 10 March until 31 March.,https://en.wikipedia.org/wiki/2020_coronavirus_pandemic_in_Romania,2020-03-10,<notion.collection.NotionDate object at 0x113f44160>,5.0
international travel ban - risk countries,Romania,"The officials announced the cessation of flights to and from Italy, at all airports in the country.",https://en.wikipedia.org/wiki/2020_coronavirus_pandemic_in_Romania,2020-03-09,<notion.collection.NotionDate object at 0x1142e0390>,5.0
international travel ban - risk countries,Switzerland,The Federal Council decided to partially close its borders and enacted border controls,https://en.wikipedia.org/wiki/2020_coronavirus_pandemic_in_Switzerland,2020-03-13,,5.0
international travel ban - risk countries,Denmark,"From 11 March, all flights from high risk regions were cancelled",https://en.wikipedia.org/wiki/2020_coronavirus_pandemic_in_Denmark,2020-03-11,,5.0
international travel ban - risk countries,Croatia,"On 2 March, the first flights to Zagreb were cancelled at 9:50 AM (CET).[48] Korean Air also announced that it would be cancelling flights on the Seoul-Zagreb line (which had been due to begin on 31 March) until 23 April.",https://en.wikipedia.org/wiki/2020_coronavirus_pandemic_in_Croatia,2020-03-02,<notion.collection.NotionDate object at 0x114a4e3c8>,5.0
international travel ban - risk countries,Croatia,"On 14 March, Croatia closed all borders with Bosnia and Herzegovina.",https://en.wikipedia.org/wiki/2020_coronavirus_pandemic_in_Croatia,2020-03-14,,5.0
international travel ban - risk countries,Netherlands,"The government cancelled all flights from China, Iran, Italy, and South Korea, the countries with the highest number of coronavirus cases, for two weeks.",https://en.wikipedia.org/wiki/2020_coronavirus_pandemic_in_the_Netherlands#cite_note-rivm:1-6,2020-03-13,,5.0
international travel ban - risk countries,Hungary,Budapest Ferenc Liszt International Airport does not allow any plane to land coming from Northern Italy,https://www.origo.hu/itthon/20200308-a-budapesti-repter-hetfotol-milanobol-bergamobol-es-trevisobol-nem-fogad-jaratokat.html,2020-03-09,,5.0
international travel ban - risk countries,Hungary,"On 6th March, it was decided that no more visas would be issued for Iranian citizens",https://www.portfolio.hu/gazdasag/20200306/uj-informaciok-jelentek-meg-a-magyarorszagi-koronavirus-helyzetrol-418413,2020-03-06,,5.0
international travel ban - risk countries,Portugal,Portugal suspended on Monday all passenger air and rail traffic with hard-hit Spain until April 15.,https://www.nytimes.com/reuters/2020/03/17/world/europe/17reuters-health-coronavirus-portugal-hotel.html,2020-03-16,,5.0
international travel ban - risk countries,Portugal,"In the Autonomous Region of Madeira the Regional Government has ordered the cessation of all flights between the region and countries where there is active transmission from Covid-19, with the exception of the national territory.",https://www.dnoticias.pt/madeira/governo-da-madeira-cessa-os-voos-dos-paises-onde-ha-transmissao-activa-AX5909301,2020-03-13,,5.0
international travel ban - risk countries,Greece,"On 16 March, Greece closed its borders with Albania and North Macedonia, deciding to suspend all road, sea and air links with these countries, while only permitting the transportation of goods and the entry of Greek nationals and residents. The suspension of ferry services to and from Italy, air links to Spain, as well as the prohibition of all cruise ships and sailboats docking in Greek ports was also decided.",https://en.wikipedia.org/wiki/2020_coronavirus_pandemic_in_Greece,2020-03-16,,5.0
international travel ban - risk countries,Greece,All air traffic with Italy was banned.,https://en.wikipedia.org/wiki/2020_coronavirus_pandemic_in_Greece,2020-03-14,,5.0
international travel ban - risk countries,Bulgaria,"The Ministry of Health announced that citizens from a number of countries would be prohibited from entering Bulgaria starting 00:00 on 18 March. These are China, Iran, Bangladesh, India, the Maldives, Nepal, Sri Lanka, Spain, Italy, South Korea, France, Germany, the Netherlands, Switzerland and the United Kingdom.",https://en.wikipedia.org/wiki/2020_coronavirus_pandemic_in_Bulgaria,2020-03-18,,5.0
international travel ban - risk countries,Macedonia,"Entries of foreign nationals to the country arriving from 'high-risk countries' would start getting denied. List of countries not specified, would act according to WHO reccommendation.",https://www.reuters.com/article/us-heath-coronavirus-northmacedonia/north-macedonia-bars-foreigners-arriving-from-high-risk-countries-over-coronavirus-idUSKBN2101NI?fbclid=IwAR0K-J4_hgAb5COQ6LxvQyV6kro6gdjpnZFgEinZ_L96HXJZsaKaavBz1UY,2020-03-13,,5.0
international traveller quarantine - risk countries,Germany,"102 German citizens and 26 relatives, all of whom were symptom-free on departure, were evacuated from the Wuhan region to Frankfurt am Main by the Executive Transport Wing of the German Air Force. After their return, they were placed in quarantine in a military barrack in Rhineland-Palatinate for 14 days.[716] The coronavirus was found in two passengers on 2 February.",https://www.tagesschau.de/inland/coronavirus-germersheim-107.html,2020-02-01,,3.0
international traveller quarantine - risk countries,United Kingdom,Britons returning from northern Italy told to self-isolate,https://www.gov.uk/guidance/coronavirus-covid-19-information-for-the-public#advice-for-travellers,2020-02-26,,3.0
